{
  "name": "sdlc-manager",
  "version": "1.6.0",
  "description": "SDLC management for Jeff Intent, Asgard, and Mount Olympus: prepared issue drafts, board schemas, labels, project fields, sub-issues, metrics, and card validation.",
  "author": {
    "name": "Infiquetra",
    "email": "hello@infiquetra.com"
  },
  "repository": "https://github.com/infiquetra/infiquetra-claude-plugins",
  "keywords": ["sdlc", "github-projects", "kanban", "issues", "labels", "metrics", "sub-issues", "mount-olympus", "asgard", "jeff-intent"]
}
