{
  "name": "cc-workflows",
  "version": "1.0.2",
  "description": "Claude Code Workflow execution for Infiquetra plans: the workflow-script emitter, the driver-owned lease and settlement contracts, and the Workflow protocol, extracted from Saga (#925).",
  "author": {
    "name": "Infiquetra",
    "email": "hello@infiquetra.com"
  },
  "repository": "https://github.com/infiquetra/infiquetra-claude-plugins",
  "keywords": [
    "cc-workflows",
    "cc-workflows-ultracode",
    "workflow",
    "execution-spec",
    "emitter",
    "explicit-invocation"
  ]
}
