{
  "name": "agy",
  "version": "0.5.1",
  "description": "Antigravity-backed coder reviewer bridge agents with guarded evidence bundles, output-attested receipts, a durable delegation-audit-store mirror, patch import, and fail-loud provenance coercion.",
  "author": {
    "name": "Infiquetra",
    "email": "hello@infiquetra.com"
  },
  "repository": "https://github.com/infiquetra/infiquetra-claude-plugins",
  "keywords": [
    "agy",
    "antigravity",
    "delegation",
    "teammate",
    "evidence"
  ]
}
