{
  "name": "redis-bridge",
  "version": "0.2.0",
  "description": "Claude Code channel that bridges sessions to external systems over Redis Streams. Pair with hermes-claude-code-router for Discord/voice via Hermes.",
  "author": {
    "name": "Infiquetra",
    "email": "hello@infiquetra.com"
  },
  "repository": "https://github.com/infiquetra/infiquetra-claude-plugins",
  "keywords": [
    "claude-code-channel",
    "mcp",
    "redis",
    "redis-streams",
    "hermes",
    "voice",
    "hands-free"
  ]
}
