{
  "name": "parallel-test-runner",
  "version": "1.0.0",
  "description": "Parallel test runner for comprehensive Python quality checks (pytest, ruff, mypy, bandit) with 4x faster execution",
  "author": {
    "name": "Infiquetra",
    "email": "hello@infiquetra.com",
    "url": "https://github.com/infiquetra/infiquetra-claude-plugins"
  },
  "homepage": "https://github.com/infiquetra/infiquetra-claude-plugins",
  "repository": "https://github.com/infiquetra/infiquetra-claude-plugins.git",
  "license": "MIT",
  "keywords": [
    "testing",
    "pytest",
    "quality",
    "python",
    "parallel",
    "ruff",
    "mypy",
    "bandit"
  ]
}
