{
  "name": "fleet-core",
  "version": "0.27.0",
  "description": "Fleet-commons library: shared primitives, liveness decisions, execution-class routing, bridge receipts, attestations, the delegation audit store, and the TypeSafe client with its jev tool.",
  "author": {
    "name": "Infiquetra",
    "email": "hello@infiquetra.com"
  },
  "repository": "https://github.com/infiquetra/infiquetra-claude-plugins",
  "keywords": [
    "fleet-commons",
    "shared-primitives",
    "tier-palette",
    "tier-resolver",
    "library",
    "typesafe",
    "jev"
  ]
}
